<?xml version="1.0"?>
<!DOCTYPE Report
[
<!ELEMENT Report (General ,(Doc|BPT)) >
<!ATTLIST Report ver CDATA #REQUIRED tmZone CDATA #REQUIRED>

<!ELEMENT General ( DocLocation ) >
<!ATTLIST General productName CDATA #REQUIRED productVer CDATA #REQUIRED os CDATA #REQUIRED host CDATA #REQUIRED qcserver CDATA #IMPLIED qcproject CDATA #IMPLIED SolManSolutionId CDATA #IMPLIED SolManProjectId CDATA #IMPLIED SolManTestPlanId CDATA #IMPLIED SolManTestPackageId CDATA #IMPLIED SolManUserInfoData CDATA #IMPLIED  >

<!ELEMENT BPT (DName,Res,DVer?,TSet?,TInst?,NodeArgs,AdditionalInfo*,Doc*) >
<!ATTLIST BPT rID ID #REQUIRED >

<!ELEMENT Doc (DName,ConfName?,Res,DVer?,TSet?,TInst?,RunType?,DT?,AdditionalInfo*,Step*,DIter*,Step*,Action*,Doc*,Summary?,TestMaintenanceSummary*,NodeArgs?) >
<!ATTLIST Doc rID ID #REQUIRED type (Test|BC|BPTWrapperTest|Flow|Group|Action) "Test" productName CDATA #REQUIRED BCIter CDATA #IMPLIED >

<!ELEMENT RunType ( #PCDATA )>
<!ATTLIST RunType fmStep (False|True) "False" batch (False|True) "False" upDesc (False|True) "False" upChk (False|True) "False" upAS (False|True) "False">

<!ELEMENT DName ( #PCDATA ) >

<!ELEMENT ConfName ( #PCDATA ) >

<!ELEMENT Res ( #PCDATA ) >

<!ELEMENT AdditionalInfo (AdditionalDataName,AdditionalDataValue ) >

<!ELEMENT AdditionalDataName ( #PCDATA ) >

<!ELEMENT AdditionalDataValue ( #PCDATA ) >

<!ELEMENT DVer ( #PCDATA ) >

<!ELEMENT TSet ( #PCDATA ) >

<!ELEMENT TInst ( #PCDATA ) >

<!ELEMENT DIter (Step*,Action+,Summary?,NodeArgs)>
<!ATTLIST DIter rID ID #REQUIRED iterID CDATA #REQUIRED>

<!ELEMENT DocLocation ( #PCDATA )>

<!ELEMENT Action (AName,AIter*,(Step|HtmlStep|Action)*, Summary,ActionMaintenanceSummary*, NodeArgs ) >
<!ATTLIST Action rID ID #REQUIRED>

<!ELEMENT AIter ((Step|HtmlStep|Action)*,DataMapping?, Summary?,NodeArgs) >
<!ATTLIST AIter rID ID #REQUIRED iterID CDATA #REQUIRED isCountable (False|True) "False" >

<!ELEMENT AName ( #PCDATA ) >

<!ELEMENT TestMaintenanceSummary (ActionMaintenanceSummary*) >
<!ATTLIST TestMaintenanceSummary ObjectsAdded CDATA #REQUIRED ObjectsUpdated CDATA #REQUIRED StepsUpdated CDATA #REQUIRED StepsComments CDATA #REQUIRED><!ELEMENT ActionMaintenanceSummary (ObjectChange* ) >
<!ATTLIST ActionMaintenanceSummary Action CDATA #REQUIRED Objects CDATA #REQUIRED Updated CDATA #REQUIRED LinesTotal CDATA #REQUIRED Added CDATA #REQUIRED LinesUpdated CDATA #REQUIRED>

<!ELEMENT ObjectChange  (Hierarchy, PropertyChangeList* ) >
<!ATTLIST ObjectChange Operation CDATA #IMPLIED OriginalRepository CDATA #IMPLIED>

<!ELEMENT PropertyChangeList (PropertyDef*) >

<!ELEMENT PropertyDef (OriginalValue, NewValue) >
<!ATTLIST PropertyDef PropName CDATA #REQUIRED OriginRegularExpression (True|False) "False" NewRegularExpression (True|False) "False" AddedProperty (True|False) "False" >

<!ELEMENT OriginalValue ( #PCDATA )>

<!ELEMENT NewValue ( #PCDATA )>

<!ELEMENT Hierarchy  (ObjectName, Hierarchy*) >
<!ATTLIST Hierarchy MicClass CDATA #REQUIRED>

<!ELEMENT ObjectName  ( #PCDATA ) >

<!ELEMENT Step (Obj,Details,Time,TimeTick* ,(Step|HtmlStep|Doc)*, DataMapping?, NodeArgs) >
<!ATTLIST Step rID ID #REQUIRED retval CDATA #IMPLIED>

<!ELEMENT HtmlStep (HTML,TimeTick*,(Step|HtmlStep|Doc)*,NodeArgs) >
<!ATTLIST HtmlStep rID ID #REQUIRED >

<!ELEMENT Obj ( #PCDATA ) >
<!ATTLIST Obj plainTxt (False|True) "True">

<!ELEMENT Details ( #PCDATA ) >
<!ATTLIST Details plainTxt (False|True) "True">

<!ELEMENT Time ( #PCDATA ) >

<!ELEMENT HTML ( #PCDATA ) >

<!ELEMENT Disp ( #PCDATA ) >

<!ELEMENT TimeTick ( #PCDATA ) >

<!ELEMENT DataMapping ( DataMappedItem* )>
<!ELEMENT DataMappedItem EMPTY >
<!ATTLIST DataMappedItem dsName CDATA #REQUIRED >
<!ATTLIST DataMappedItem rowId CDATA #REQUIRED >

<!ELEMENT NodeArgs (Disp,TopPane?,BtmPane?,ExtendedInfo? )>
<!ATTLIST NodeArgs eType CDATA #REQUIRED icon CDATA #REQUIRED nRep CDATA #REQUIRED UserNote CDATA #IMPLIED filter (False|True) "True">
<!ATTLIST NodeArgs status (Passed|Failed|Done|Warning|Information) "Done">
<!ATTLIST NodeArgs iconSel CDATA #IMPLIED nType CDATA #IMPLIED MovieMarker CDATA "">
<!ATTLIST NodeArgs Source CDATA #IMPLIED SourceLine CDATA #IMPLIED StepFlowItemKey CDATA #IMPLIED >

<!ELEMENT TopPane (Path)>

<!ELEMENT BtmPane ( (Path|WR)?,ASHilite?)>
<!ATTLIST BtmPane vType CDATA "HTML">

<!ELEMENT Path ( #PCDATA ) >

<!ELEMENT ASHilite ( #PCDATA ) >

<!ELEMENT WR ( #PCDATA ) >

<!ELEMENT ExtendedInfo ( StepData ) >

<!ATTLIST ExtendedInfo StepType CDATA #REQUIRED>
<!ELEMENT DT (NodeArgs) >
<!ATTLIST DT rID ID #REQUIRED>

<!ELEMENT Summary (Param*)>
<!ATTLIST Summary sTime CDATA #IMPLIED eTime CDATA #IMPLIED passed CDATA #IMPLIED failed CDATA #IMPLIED warnings CDATA #IMPLIED retval CDATA #IMPLIED stopped (False|True) "False" >

<!ELEMENT Param (ParamName,ParamVal)+ >
<!ATTLIST Param paramInOut (In|Out) "In">

<!ELEMENT ParamName ( #PCDATA ) >

<!ELEMENT ParamVal ( #PCDATA ) >

]
>
<Report ver="2.0" tmZone="India Standard Time">
<General productName="Micro Focus UFT One" productVer="2023" os="Windows 10" host="DINM5CD140FS86"><DocLocation><![CDATA[C:\Users\z004u4nm\Documents\UFT One\login]]></DocLocation></General>
<Doc rID="T1"   productName= "Micro Focus UFT One"  >
<DName><![CDATA[login]]></DName>
<Res><![CDATA[Res1]]></Res>
<DT rID="T2">
<NodeArgs eType="Table" icon="2" nRep="4" filter="False" >
<Disp><![CDATA[Run-Time Data Table]]></Disp>
<BtmPane vType="Table" >
<Path><![CDATA[Default.xlsx]]></Path>
</BtmPane>
</NodeArgs>
</DT>
<DIter rID="T3" iterID="1" >
<Action rID="T4">
<AName><![CDATA[AWC_end _to_end]]></AName>
<Step rID="T5">
<Obj plainTxt="False" ><![CDATA[SystemUtil]]></Obj>
<Details plainTxt="False" ><![CDATA[SystemUtil]]></Details>
<Time><![CDATA[9/27/2023 - 12:06:32]]></Time>
<TimeTick>1695796592</TimeTick>
<Step rID="T6">
<Obj plainTxt="False" ><![CDATA[Run "chrome.exe",1]]></Obj>
<Details plainTxt="False" ><![CDATA[Run "chrome.exe",1]]></Details>
<Time><![CDATA[9/27/2023 - 12:06:32]]></Time>
<TimeTick>1695796592</TimeTick>
<NodeArgs eType="Replay" icon="5" nRep="11" status="Passed" Source="AWC_end _to_end" SourceLine="6" >
<Disp><![CDATA[Run "chrome.exe",1]]></Disp>
</NodeArgs>
</Step>
<NodeArgs eType="Replay" icon="5" nRep="10" status="Passed" Source="AWC_end _to_end" SourceLine="6" >
<Disp><![CDATA[SystemUtil]]></Disp>
</NodeArgs>
</Step>
<Step rID="T7">
<Obj plainTxt="False" ><![CDATA[BT StartUpManager]]></Obj>
<Details plainTxt="False" ><![CDATA[<table><tr><td><span style="text-align : left; font-size : 12px; ">Local Browser</span></td></tr></table>]]></Details>
<Time><![CDATA[9/27/2023 - 12:06:38]]></Time>
<TimeTick>1695796598</TimeTick>
<Step rID="T8">
<Obj plainTxt="False" ><![CDATA["BT StartUpManager"- Smart Identification]]></Obj>
<Details plainTxt="False" ><![CDATA[<P><span class="text">The smart identification mechanism was invoked.</span></P><P><SPAN class=text>Reason: object not unique (4 objects found)</SPAN></P>           <SPAN class=text><b>Original description:</b></SPAN><br>micclass=Browser<br><P><FONT face=Verdana size=2><SPAN class=text><B>Smart Identification Alternative Description: </B></SPAN></FONT></P><FONT face=Verdana size=2><u>Base filter properties (4 objects found)&nbsp;</FONT></u><br>
micclass=Browser<br><br><FONT face=Verdana size=2><u>Optional filter properties</FONT></u><br>
name=BT StartUpManager 2023-09-04 11:06<SPAN class=Failed> (Skipped)</SPAN><br>title=BT StartUpManager 2023-09-04 11:06<SPAN class=Failed> (Skipped)</SPAN><br>openurl=https://gplm.automation.siemens.com/globalconf/sm/sm2.html?version=cat&project=bt<SPAN class=passed> (Used</SPAN>, 1 matches)</SPAN><br>opentitle=IEC StartUpManager 2023-09-04 11:06<SPAN class=warning> (Ignored)<FONT color=#000000></FONT></SPAN><br>openedbytestingtool=0<SPAN class=warning> (Ignored)<FONT color=#000000></FONT></SPAN><br>number of tabs=5<SPAN class=warning> (Ignored)<FONT color=#000000></FONT></SPAN><br>]]></Details>
<Time><![CDATA[9/27/2023 - 12:06:38]]></Time>
<TimeTick>1695796598</TimeTick>
<NodeArgs eType="Replay" icon="7" nRep="13" Source="AWC_end _to_end" SourceLine="13" >
<Disp><![CDATA["BT StartUpManager"- Smart Identification]]></Disp>
</NodeArgs>
</Step>
<Step rID="T9">
<Obj plainTxt="False" ><![CDATA[BT StartUpManager.Maximize]]></Obj>
<Details plainTxt="False" ><![CDATA[]]></Details>
<Time><![CDATA[9/27/2023 - 12:06:38]]></Time>
<TimeTick>1695796598</TimeTick>
<NodeArgs eType="Replay" icon="6" nRep="15" Source="AWC_end _to_end" SourceLine="13" >
<Disp><![CDATA[BT StartUpManager.Maximize]]></Disp>
</NodeArgs>
</Step>
<Step rID="T10">
<Obj plainTxt="False" ><![CDATA[BT StartUpManager.ClearCache]]></Obj>
<Details plainTxt="False" ><![CDATA[]]></Details>
<Time><![CDATA[9/27/2023 - 12:06:38]]></Time>
<TimeTick>1695796598</TimeTick>
<NodeArgs eType="Replay" icon="6" nRep="16" Source="AWC_end _to_end" SourceLine="14" >
<Disp><![CDATA[BT StartUpManager.ClearCache]]></Disp>
</NodeArgs>
</Step>
<Step rID="T11">
<Obj plainTxt="False" ><![CDATA[BT StartUpManager]]></Obj>
<Details plainTxt="False" ><![CDATA[Page]]></Details>
<Time><![CDATA[9/27/2023 - 12:06:41]]></Time>
<TimeTick>1695796601</TimeTick>
<Step rID="T12">
<Obj plainTxt="False" ><![CDATA[AWC__BT_text.Object]]></Obj>
<Details plainTxt="False" ><![CDATA[]]></Details>
<Time><![CDATA[9/27/2023 - 12:06:41]]></Time>
<TimeTick>1695796601</TimeTick>
<NodeArgs eType="Replay" icon="9" nRep="18" Source="AWC_end _to_end" SourceLine="20" >
<Disp><![CDATA[AWC__BT_text.Object]]></Disp>
</NodeArgs>
</Step>
<Step rID="T13">
<Obj plainTxt="False" ><![CDATA[AWC__BT__Q.Object]]></Obj>
<Details plainTxt="False" ><![CDATA[]]></Details>
<Time><![CDATA[9/27/2023 - 12:06:43]]></Time>
<TimeTick>1695796603</TimeTick>
<NodeArgs eType="Replay" icon="9" nRep="20" Source="AWC_end _to_end" SourceLine="25" >
<Disp><![CDATA[AWC__BT__Q.Object]]></Disp>
</NodeArgs>
</Step>
<Step rID="T14">
<Obj plainTxt="False" ><![CDATA[AWC__BT__Q.Click]]></Obj>
<Details plainTxt="False" ><![CDATA[]]></Details>
<Time><![CDATA[9/27/2023 - 12:06:45]]></Time>
<TimeTick>1695796605</TimeTick>
<NodeArgs eType="Replay" icon="9" nRep="24" Source="AWC_end _to_end" SourceLine="30" >
<Disp><![CDATA[AWC__BT__Q.Click]]></Disp>
</NodeArgs>
</Step>
<Step rID="T15">
<Obj plainTxt="False" ><![CDATA[server_ID_dropdown.Select]]></Obj>
<Details plainTxt="False" ><![CDATA["MyTC R2.2 QA (TCBQ10) TC 13.2"]]></Details>
<Time><![CDATA[9/27/2023 - 12:06:49]]></Time>
<TimeTick>1695796609</TimeTick>
<NodeArgs eType="Replay" icon="10" nRep="27" Source="AWC_end _to_end" SourceLine="32" >
<Disp><![CDATA[server_ID_dropdown.Select]]></Disp>
</NodeArgs>
</Step>
<Step rID="T16">
<Obj plainTxt="False" ><![CDATA[Start AWC.Submit]]></Obj>
<Details plainTxt="False" ><![CDATA[]]></Details>
<Time><![CDATA[9/27/2023 - 12:06:51]]></Time>
<TimeTick>1695796611</TimeTick>
<NodeArgs eType="Replay" icon="11" nRep="30" Source="AWC_end _to_end" SourceLine="35" >
<Disp><![CDATA[Start AWC.Submit]]></Disp>
</NodeArgs>
</Step>
<NodeArgs eType="Context" icon="8" nRep="17" Source="AWC_end _to_end" SourceLine="20" >
<Disp><![CDATA[BT StartUpManager]]></Disp>
</NodeArgs>
</Step>
<NodeArgs eType="Context" icon="6" nRep="12" Source="AWC_end _to_end" SourceLine="13" >
<Disp><![CDATA[BT StartUpManager]]></Disp>
</NodeArgs>
</Step>
<Step rID="T17">
<Obj ><![CDATA[Environment Selection]]></Obj>
<Details ><![CDATA[TCBQ10 selected successfully]]></Details>
<Time><![CDATA[9/27/2023 - 12:06:52]]></Time>
<TimeTick>1695796612</TimeTick>
<NodeArgs eType="User" icon="12" nRep="31" status="Passed" Source="AWC_end _to_end" SourceLine="37" >
<Disp><![CDATA[Environment Selection]]></Disp>
</NodeArgs>
</Step>
<Step rID="T18">
<Obj plainTxt="False" ><![CDATA[Teamcenter - Home]]></Obj>
<Details plainTxt="False" ><![CDATA[<table><tr><td><span style="text-align : left; font-size : 12px; ">Local Browser</span></td></tr></table>]]></Details>
<Time><![CDATA[9/27/2023 - 12:06:57]]></Time>
<TimeTick>1695796617</TimeTick>
<Step rID="T19">
<Obj plainTxt="False" ><![CDATA["Teamcenter - Home"- Smart Identification]]></Obj>
<Details plainTxt="False" ><![CDATA[<P><span class="text">The smart identification mechanism was invoked.</span></P><P><SPAN class=text>Reason: object not unique (5 objects found)</SPAN></P>           <SPAN class=text><b>Original description:</b></SPAN><br>micclass=Browser<br><P><FONT face=Verdana size=2><SPAN class=text><B>Smart Identification Alternative Description: </B></SPAN></FONT></P><FONT face=Verdana size=2><u>Base filter properties (5 objects found)&nbsp;</FONT></u><br>
micclass=Browser<br><br><FONT face=Verdana size=2><u>Optional filter properties</FONT></u><br>
name=Teamcenter - Home<SPAN class=Failed> (Skipped)</SPAN><br>title=Teamcenter - Home<SPAN class=Failed> (Skipped)</SPAN><br>openurl=https://tcbqlb.gplm.siemens.com/tcbq10awc/?locale=en_US<SPAN class=passed> (Used</SPAN>, 1 matches)</SPAN><br>opentitle=<SPAN class=warning> (Ignored)<FONT color=#000000></FONT></SPAN><br>openedbytestingtool=0<SPAN class=warning> (Ignored)<FONT color=#000000></FONT></SPAN><br>number of tabs=2<SPAN class=warning> (Ignored)<FONT color=#000000></FONT></SPAN><br>]]></Details>
<Time><![CDATA[9/27/2023 - 12:06:57]]></Time>
<TimeTick>1695796617</TimeTick>
<NodeArgs eType="Replay" icon="7" nRep="33" Source="AWC_end _to_end" SourceLine="68" >
<Disp><![CDATA["Teamcenter - Home"- Smart Identification]]></Disp>
</NodeArgs>
</Step>
<Step rID="T20">
<Obj plainTxt="False" ><![CDATA[signinstage.siemens.com/regpub]]></Obj>
<Details plainTxt="False" ><![CDATA[Page]]></Details>
<Time><![CDATA[9/27/2023 - 12:07:14]]></Time>
<TimeTick>1695796634</TimeTick>
<Step rID="T21">
<Obj plainTxt="False" ><![CDATA[LoginButton.Exist]]></Obj>
<Details plainTxt="False" ><![CDATA["Object exists"]]></Details>
<Time><![CDATA[9/27/2023 - 12:07:14]]></Time>
<TimeTick>1695796634</TimeTick>
<NodeArgs eType="Replay" icon="11" nRep="37" Source="AWC_end _to_end" SourceLine="68" >
<Disp><![CDATA[LoginButton.Exist]]></Disp>
</NodeArgs>
</Step>
<Step rID="T22">
<Obj plainTxt="False" ><![CDATA[login_time]]></Obj>
<Details plainTxt="False" ><![CDATA[Transaction "login_time" started.]]></Details>
<Time><![CDATA[9/27/2023 - 12:07:14]]></Time>
<TimeTick>1695796634</TimeTick>
<NodeArgs eType="Transaction" icon="13" nRep="38" nType="Start Transaction" Source="AWC_end _to_end" SourceLine="69" >
<Disp><![CDATA[login_time]]></Disp>
</NodeArgs>
</Step>
<Step rID="T23">
<Obj plainTxt="False" ><![CDATA[LoginButton.Click]]></Obj>
<Details plainTxt="False" ><![CDATA[]]></Details>
<Time><![CDATA[9/27/2023 - 12:07:14]]></Time>
<TimeTick>1695796634</TimeTick>
<NodeArgs eType="Replay" icon="11" nRep="41" Source="AWC_end _to_end" SourceLine="71" >
<Disp><![CDATA[LoginButton.Click]]></Disp>
</NodeArgs>
</Step>
<NodeArgs eType="Context" icon="8" nRep="36" Source="AWC_end _to_end" SourceLine="68" >
<Disp><![CDATA[signinstage.siemens.com/regpub]]></Disp>
</NodeArgs>
</Step>
<Step rID="T24">
<Obj plainTxt="False" ><![CDATA[InsightObject.Click]]></Obj>
<Details plainTxt="False" ><![CDATA[]]></Details>
<Time><![CDATA[9/27/2023 - 12:07:35]]></Time>
<TimeTick>1695796655</TimeTick>
<NodeArgs eType="Replay" icon="14" nRep="44" status="Warning" Source="AWC_end _to_end" SourceLine="74" >
<Disp><![CDATA[InsightObject.Click]]></Disp>
</NodeArgs>
</Step>
<Step rID="T25">
<Obj plainTxt="False" ><![CDATA[InsightObject]]></Obj>
<Details plainTxt="False" ><![CDATA[Cannot&nbsp;identify&nbsp;the&nbsp;object&nbsp;"InsightObject"&nbsp;(of&nbsp;class&nbsp;InsightObject).<br/>Verify&nbsp;that&nbsp;this&nbsp;object's&nbsp;properties&nbsp;match&nbsp;an&nbsp;object&nbsp;currently&nbsp;displayed&nbsp;in&nbsp;your&nbsp;application.]]></Details>
<Time><![CDATA[9/27/2023 - 12:07:35]]></Time>
<TimeTick>1695796655</TimeTick>
<Step rID="T26">
<Obj plainTxt="False" ><![CDATA[InsightObject]]></Obj>
<Details plainTxt="False" ><![CDATA[Object's physical description:<br>Object image = <img src="Images\InsightObject.png"/><br/>]]></Details>
<Time><![CDATA[9/27/2023 - 12:07:35]]></Time>
<TimeTick>1695796655</TimeTick>
<NodeArgs eType="Replay" icon="15" nRep="46" status="Warning" nType="Description" Source="AWC_end _to_end" SourceLine="74" >
<Disp><![CDATA[InsightObject]]></Disp>
</NodeArgs>
</Step>
<NodeArgs eType="Replay" icon="14" nRep="45" status="Warning" nType="Run Error" Source="AWC_end _to_end" SourceLine="74" >
<Disp><![CDATA[InsightObject]]></Disp>
</NodeArgs>
</Step>
<Step rID="T27">
<Obj plainTxt="False" ><![CDATA[InsightObject.Click]]></Obj>
<Details plainTxt="False" ><![CDATA[]]></Details>
<Time><![CDATA[9/27/2023 - 12:08:00]]></Time>
<TimeTick>1695796680</TimeTick>
<NodeArgs eType="Replay" icon="14" nRep="49" status="Warning" Source="AWC_end _to_end" SourceLine="74" >
<Disp><![CDATA[InsightObject.Click]]></Disp>
</NodeArgs>
</Step>
<Step rID="T28">
<Obj plainTxt="False" ><![CDATA[InsightObject]]></Obj>
<Details plainTxt="False" ><![CDATA[Cannot&nbsp;identify&nbsp;the&nbsp;object&nbsp;"InsightObject"&nbsp;(of&nbsp;class&nbsp;InsightObject).<br/>Verify&nbsp;that&nbsp;this&nbsp;object's&nbsp;properties&nbsp;match&nbsp;an&nbsp;object&nbsp;currently&nbsp;displayed&nbsp;in&nbsp;your&nbsp;application.]]></Details>
<Time><![CDATA[9/27/2023 - 12:08:00]]></Time>
<TimeTick>1695796680</TimeTick>
<Step rID="T29">
<Obj plainTxt="False" ><![CDATA[InsightObject]]></Obj>
<Details plainTxt="False" ><![CDATA[Object's physical description:<br>Object image = <img src="Images\InsightObject_1.png"/><br/>]]></Details>
<Time><![CDATA[9/27/2023 - 12:08:00]]></Time>
<TimeTick>1695796680</TimeTick>
<NodeArgs eType="Replay" icon="15" nRep="51" status="Warning" nType="Description" Source="AWC_end _to_end" SourceLine="74" >
<Disp><![CDATA[InsightObject]]></Disp>
</NodeArgs>
</Step>
<NodeArgs eType="Replay" icon="14" nRep="50" status="Warning" nType="Run Error" Source="AWC_end _to_end" SourceLine="74" >
<Disp><![CDATA[InsightObject]]></Disp>
</NodeArgs>
</Step>
<HtmlStep rID="T30">
<HTML><![CDATA[<table border="0" cellpadding="0" cellspacing="0" width="100%" id=TABLE2><tr height="1"><td height="1" class="bg_gray_ccc"></td></tr><tr><td height="5"></td></tr></table><table>
	<tr><td height="30"><span class="hl2"> Details</span></td></tr><tr><td height="5"></td></tr>
</table>
<span class="text"><head>
<META HTTP-EQUIV="Content-Type" CONTENT="text/html; charset=UTF-8"/>
<link rel="stylesheet" href="C:\Program Files\HP\QuickTest Professional\dat\Results.css">
</head>
<body bgcolor="#ffffff" leftmargin="20" marginwidth="20" topmargin="10" marginheight="10" vlink="#9966cc"><table border="0" cellpadding="0" cellspacing="0" width="100%">
<tr><td height="1" class="bg_midblue"></td></tr>
<tr><td height="30"><p><span class="hl1"> Step Name:<b> Maintenance Mode Update Result</span></b></p></td></tr>
<tr><td height="2" class="bg_darkblue"></td></tr>
<tr><td height="30"><span class="Done"> Step Done</span></td></tr>
<tr><td height="5"></td></tr>
</table>

<table border="0" cellpadding="3" cellspacing="1" width="100%" bgcolor="#666699">
<tr><td bgcolor="white">
                                       
      <table border="0" cellpadding="3" cellspacing="0" width="100%">
      <tr>
          <td valign="middle" align="left" class="tablehl"> <span class="tablehl">Action  </span> </td>
         <td valign="middle" align="left" class="tablehl"> <span class="tablehl">Details </span> </td>
 </tr>
 <tr >
         <td  height="1" class="bg_darkblue"></td>
         <td  height="1" class="bg_darkblue"></td>
 </tr>
<TR>
        <td><span class="text">Script line was updated by maintenance process</span></td>
       <TD><span class="text">The script line #76 containing 'Browser("Teamcenter - Home").InsightObject("InsightObject").Click' was skipped</span></TD>
</TR>
<tr>
  <td height="1" class="bg_gray_eee"></td>
  <td height="1" class="bg_gray_eee"></td>
</tr>
</table> 
</td></tr>
</table></center>
</BODY></span>]]></HTML>
<TimeTick>1695796777</TimeTick>
<NodeArgs eType="Replay" icon="16" nRep="52" Source="AWC_end _to_end" SourceLine="75" >
<Disp><![CDATA[Maintenance]]></Disp>
</NodeArgs>
</HtmlStep>
<NodeArgs eType="Context" icon="6" nRep="32" status="Warning" Source="AWC_end _to_end" SourceLine="68" >
<Disp><![CDATA[Teamcenter - Home]]></Disp>
</NodeArgs>
</Step>
<Step rID="T31">
<Obj plainTxt="False" ><![CDATA[Windows Security]]></Obj>
<Details plainTxt="False" ><![CDATA[UIAWindow]]></Details>
<Time><![CDATA[9/27/2023 - 12:09:43]]></Time>
<TimeTick>1695796783</TimeTick>
<Step rID="T32">
<Obj plainTxt="False" ><![CDATA[Windows Security.Activate]]></Obj>
<Details plainTxt="False" ><![CDATA[]]></Details>
<Time><![CDATA[9/27/2023 - 12:09:43]]></Time>
<TimeTick>1695796783</TimeTick>
<NodeArgs eType="Replay" icon="17" nRep="55" Source="AWC_end _to_end" SourceLine="78" >
<Disp><![CDATA[Windows Security.Activate]]></Disp>
</NodeArgs>
</Step>
<Step rID="T33">
<Obj plainTxt="False" ><![CDATA[PIN]]></Obj>
<Details plainTxt="False" ><![CDATA[UIAEdit]]></Details>
<Time><![CDATA[9/27/2023 - 12:09:44]]></Time>
<TimeTick>1695796784</TimeTick>
<Step rID="T34">
<Obj plainTxt="False" ><![CDATA[PKI_PIN.SetValue]]></Obj>
<Details plainTxt="False" ><![CDATA["83800718"]]></Details>
<Time><![CDATA[9/27/2023 - 12:09:44]]></Time>
<TimeTick>1695796784</TimeTick>
<NodeArgs eType="Replay" icon="18" nRep="58" Source="AWC_end _to_end" SourceLine="79" >
<Disp><![CDATA[PKI_PIN.SetValue]]></Disp>
</NodeArgs>
</Step>
<NodeArgs eType="Context" icon="18" nRep="57" Source="AWC_end _to_end" SourceLine="79" >
<Disp><![CDATA[PIN]]></Disp>
</NodeArgs>
</Step>
<NodeArgs eType="Context" icon="17" nRep="54" Source="AWC_end _to_end" SourceLine="78" >
<Disp><![CDATA[Windows Security]]></Disp>
</NodeArgs>
</Step>
<Step rID="T35">
<Obj plainTxt="False" ><![CDATA[Windows Security]]></Obj>
<Details plainTxt="False" ><![CDATA[Window]]></Details>
<Time><![CDATA[9/27/2023 - 12:09:45]]></Time>
<TimeTick>1695796785</TimeTick>
<Step rID="T36">
<Obj plainTxt="False" ><![CDATA[InsightObjectPKI.Click]]></Obj>
<Details plainTxt="False" ><![CDATA[]]></Details>
<Time><![CDATA[9/27/2023 - 12:09:45]]></Time>
<TimeTick>1695796785</TimeTick>
<NodeArgs eType="Replay" icon="14" nRep="61" Source="AWC_end _to_end" SourceLine="81" >
<Disp><![CDATA[InsightObjectPKI.Click]]></Disp>
</NodeArgs>
</Step>
<Step rID="T37">
<Obj plainTxt="False" ><![CDATA[login_time]]></Obj>
<Details plainTxt="False" ><![CDATA[Transaction "login_time" ended with "Pass" status (Total Duration: 150.6951 sec).]]></Details>
<Time><![CDATA[9/27/2023 - 12:09:45]]></Time>
<TimeTick>1695796785</TimeTick>
<NodeArgs eType="Transaction" icon="20" nRep="62" nType="End Transaction" Source="AWC_end _to_end" SourceLine="83" >
<Disp><![CDATA[login_time]]></Disp>
</NodeArgs>
</Step>
<NodeArgs eType="Context" icon="19" nRep="60" Source="AWC_end _to_end" SourceLine="81" >
<Disp><![CDATA[Windows Security]]></Disp>
</NodeArgs>
</Step>
<Step rID="T38">
<Obj ><![CDATA[PKI Authentication]]></Obj>
<Details ><![CDATA[successful]]></Details>
<Time><![CDATA[9/27/2023 - 12:09:45]]></Time>
<TimeTick>1695796785</TimeTick>
<NodeArgs eType="User" icon="12" nRep="63" status="Passed" Source="AWC_end _to_end" SourceLine="84" >
<Disp><![CDATA[PKI Authentication]]></Disp>
</NodeArgs>
</Step>
<Step rID="T39">
<Obj plainTxt="False" ><![CDATA[Teamcenter - Home]]></Obj>
<Details plainTxt="False" ><![CDATA[<table><tr><td><span style="text-align : left; font-size : 12px; ">Local Browser</span></td></tr></table>]]></Details>
<Time><![CDATA[9/27/2023 - 12:10:44]]></Time>
<TimeTick>1695796844</TimeTick>
<Step rID="T40">
<Obj plainTxt="False" ><![CDATA[Teamcenter - Home]]></Obj>
<Details plainTxt="False" ><![CDATA[Page]]></Details>
<Time><![CDATA[9/27/2023 - 12:10:44]]></Time>
<TimeTick>1695796844</TimeTick>
<Step rID="T41">
<Obj plainTxt="False" ><![CDATA[Home.Exist]]></Obj>
<Details plainTxt="False" ><![CDATA["Object exists"]]></Details>
<Time><![CDATA[9/27/2023 - 12:10:44]]></Time>
<TimeTick>1695796844</TimeTick>
<NodeArgs eType="Replay" icon="11" nRep="113" Source="AWC_end _to_end" SourceLine="86" >
<Disp><![CDATA[Home.Exist]]></Disp>
</NodeArgs>
</Step>
<Step rID="T42">
<Obj ><![CDATA[UserNote]]></Obj>
<Details ><![CDATA[Login Duration : 253.4297]]></Details>
<Time><![CDATA[9/27/2023 - 12:10:45]]></Time>
<TimeTick>1695796845</TimeTick>
<NodeArgs eType="User" icon="0" nRep="114" UserNote="yes" Source="AWC_end _to_end" SourceLine="90" >
<Disp><![CDATA[UserNote]]></Disp>
</NodeArgs>
</Step>
<Step rID="T43">
<Obj plainTxt="False" ><![CDATA[Home.Exist]]></Obj>
<Details plainTxt="False" ><![CDATA["Object exists"]]></Details>
<Time><![CDATA[9/27/2023 - 12:10:45]]></Time>
<TimeTick>1695796845</TimeTick>
<NodeArgs eType="Replay" icon="11" nRep="116" Source="AWC_end _to_end" SourceLine="104" >
<Disp><![CDATA[Home.Exist]]></Disp>
</NodeArgs>
</Step>
<Step rID="T44">
<Obj plainTxt="False" ><![CDATA[global_search_time]]></Obj>
<Details plainTxt="False" ><![CDATA[Transaction "global_search_time" started.]]></Details>
<Time><![CDATA[9/27/2023 - 12:10:45]]></Time>
<TimeTick>1695796845</TimeTick>
<NodeArgs eType="Transaction" icon="13" nRep="117" nType="Start Transaction" Source="AWC_end _to_end" SourceLine="105" >
<Disp><![CDATA[global_search_time]]></Disp>
</NodeArgs>
</Step>
<Step rID="T45">
<Obj plainTxt="False" ><![CDATA[Home.Click]]></Obj>
<Details plainTxt="False" ><![CDATA[]]></Details>
<Time><![CDATA[9/27/2023 - 12:10:45]]></Time>
<TimeTick>1695796845</TimeTick>
<NodeArgs eType="Replay" icon="11" nRep="120" Source="AWC_end _to_end" SourceLine="108" >
<Disp><![CDATA[Home.Click]]></Disp>
</NodeArgs>
</Step>
<Step rID="T46">
<Obj plainTxt="False" ><![CDATA[Search Box.Set]]></Obj>
<Details plainTxt="False" ><![CDATA["*"]]></Details>
<Time><![CDATA[9/27/2023 - 12:10:48]]></Time>
<TimeTick>1695796848</TimeTick>
<NodeArgs eType="Replay" icon="21" nRep="123" Source="AWC_end _to_end" SourceLine="111" >
<Disp><![CDATA[Search Box.Set]]></Disp>
</NodeArgs>
</Step>
<Step rID="T47">
<Obj plainTxt="False" ><![CDATA[searchIcon.Click]]></Obj>
<Details plainTxt="False" ><![CDATA[]]></Details>
<Time><![CDATA[9/27/2023 - 12:10:50]]></Time>
<TimeTick>1695796850</TimeTick>
<NodeArgs eType="Replay" icon="9" nRep="126" Source="AWC_end _to_end" SourceLine="113" >
<Disp><![CDATA[searchIcon.Click]]></Disp>
</NodeArgs>
</Step>
<Step rID="T48">
<Obj plainTxt="False" ><![CDATA[Search Results by Category.Exist]]></Obj>
<Details plainTxt="False" ><![CDATA["Object exists"]]></Details>
<Time><![CDATA[9/27/2023 - 12:11:46]]></Time>
<TimeTick>1695796906</TimeTick>
<NodeArgs eType="Replay" icon="9" nRep="372" Source="AWC_end _to_end" SourceLine="118" >
<Disp><![CDATA[Search Results by Category.Exist]]></Disp>
</NodeArgs>
</Step>
<NodeArgs eType="Context" icon="8" nRep="112" Source="AWC_end _to_end" SourceLine="86" >
<Disp><![CDATA[Teamcenter - Home]]></Disp>
</NodeArgs>
</Step>
<NodeArgs eType="Context" icon="6" nRep="111" Source="AWC_end _to_end" SourceLine="86" >
<Disp><![CDATA[Teamcenter - Home]]></Disp>
</NodeArgs>
</Step>
<Step rID="T49">
<Obj ><![CDATA[GlobalSearch ]]></Obj>
<Details ><![CDATA[GlobalSearch is successful]]></Details>
<Time><![CDATA[9/27/2023 - 12:11:46]]></Time>
<TimeTick>1695796906</TimeTick>
<NodeArgs eType="User" icon="12" nRep="373" status="Passed" Source="AWC_end _to_end" SourceLine="119" >
<Disp><![CDATA[GlobalSearch ]]></Disp>
</NodeArgs>
</Step>
<Step rID="T50">
<Obj ><![CDATA[UserNote]]></Obj>
<Details ><![CDATA[GlobalSearch Duration : 60.60938]]></Details>
<Time><![CDATA[9/27/2023 - 12:11:46]]></Time>
<TimeTick>1695796906</TimeTick>
<NodeArgs eType="User" icon="0" nRep="374" UserNote="yes" Source="AWC_end _to_end" SourceLine="123" >
<Disp><![CDATA[UserNote]]></Disp>
</NodeArgs>
</Step>
<Step rID="T51">
<Obj plainTxt="False" ><![CDATA[global_search_time]]></Obj>
<Details plainTxt="False" ><![CDATA[Transaction "global_search_time" ended with "Pass" status (Total Duration: 61.1574 sec).]]></Details>
<Time><![CDATA[9/27/2023 - 12:11:46]]></Time>
<TimeTick>1695796906</TimeTick>
<NodeArgs eType="Transaction" icon="20" nRep="375" nType="End Transaction" Source="AWC_end _to_end" SourceLine="125" >
<Disp><![CDATA[global_search_time]]></Disp>
</NodeArgs>
</Step>
<Step rID="T52">
<Obj plainTxt="False" ><![CDATA[upload_test_time]]></Obj>
<Details plainTxt="False" ><![CDATA[Transaction "upload_test_time" started.]]></Details>
<Time><![CDATA[9/27/2023 - 12:11:47]]></Time>
<TimeTick>1695796907</TimeTick>
<NodeArgs eType="Transaction" icon="13" nRep="376" nType="Start Transaction" Source="AWC_end _to_end" SourceLine="131" >
<Disp><![CDATA[upload_test_time]]></Disp>
</NodeArgs>
</Step>
<Step rID="T53">
<Obj plainTxt="False" ><![CDATA[Teamcenter - Home]]></Obj>
<Details plainTxt="False" ><![CDATA[<table><tr><td><span style="text-align : left; font-size : 12px; ">Local Browser</span></td></tr></table>]]></Details>
<Time><![CDATA[9/27/2023 - 12:11:47]]></Time>
<TimeTick>1695796907</TimeTick>
<Step rID="T54">
<Obj plainTxt="False" ><![CDATA[Teamcenter - Home]]></Obj>
<Details plainTxt="False" ><![CDATA[Page]]></Details>
<Time><![CDATA[9/27/2023 - 12:11:47]]></Time>
<TimeTick>1695796907</TimeTick>
<Step rID="T55">
<Obj plainTxt="False" ><![CDATA[FoldersButton.Exist]]></Obj>
<Details plainTxt="False" ><![CDATA["Object exists"]]></Details>
<Time><![CDATA[9/27/2023 - 12:11:47]]></Time>
<TimeTick>1695796907</TimeTick>
<NodeArgs eType="Replay" icon="11" nRep="380" Source="AWC_end _to_end" SourceLine="140" >
<Disp><![CDATA[FoldersButton.Exist]]></Disp>
</NodeArgs>
</Step>
<Step rID="T56">
<Obj plainTxt="False" ><![CDATA[FoldersButton.Click]]></Obj>
<Details plainTxt="False" ><![CDATA[]]></Details>
<Time><![CDATA[9/27/2023 - 12:11:48]]></Time>
<TimeTick>1695796908</TimeTick>
<NodeArgs eType="Replay" icon="11" nRep="383" Source="AWC_end _to_end" SourceLine="141" >
<Disp><![CDATA[FoldersButton.Click]]></Disp>
</NodeArgs>
</Step>
<Step rID="T57">
<Obj plainTxt="False" ><![CDATA[CreateNewObjectIcon.Exist]]></Obj>
<Details plainTxt="False" ><![CDATA["Object exists"]]></Details>
<Time><![CDATA[9/27/2023 - 12:11:53]]></Time>
<TimeTick>1695796913</TimeTick>